{
  "id": "calves",
  "name": "Calves (Gastrocnemius & Soleus)",
  "group": "legs",
  "regions": ["gastrocnemius (medial & lateral)", "soleus"],
  "functions": ["ankle plantarflexion", "knee flexion assist (gastrocnemius)"],
  "landmarks": {
    "unit": "weekly_hard_sets",
    "mv": { "min": 6, "max": 6 },
    "mev": { "min": 8, "max": 8 },
    "mav": { "min": 12, "max": 16 },
    "mrv": { "min": 20, "max": 20 },
    "evidence_grade": "C",
    "citations": ["schoenfeld-2017-volume-dose-response", "baz-valle-2022-volume-review"],
    "notes": "Little indirect work; tolerates frequent training. Knee angle selects the head trained. Estimate only."
  },
  "frequency_notes": "Responds to high frequency (2-4x/week) of direct work.",
  "training_notes": "Straight-leg raises (standing/leg-press) target the gastrocnemius; bent-knee (seated) raises target the soleus. Pause in the stretched bottom position; avoid bouncing.",
  "citations": ["schoenfeld-2017-volume-dose-response"]
}
